name,name_norm,partido,pacto,tbip,tbip_raw,sigma_x,ci_low,ci_high,rank_tbip,interventions,nominate_1d,nominate_z,nominate_general_1d,tbip_z,divergencia,abs_divergencia,clasificacion,caso_incierto,n_votos,rank_nominate
Jorge Guzmán Zepeda,jorge guzman zepeda,EVOP,Chile Vamos,-0.805062,-0.84831,0.018939,-0.842182,-0.767942,1,"[{'fecha': '2025-03-12', 'polo': 'negativo', 'text': 'es realmente indignante, frustrante y molesto, y genera una serie de situaciones negativas para el país, estar en conocimiento de organizaciones que son verdaderas bandas criminales que se dedican a defraudar a través de la emisión fraudulenta de licencias médicas. Un solo caso, que involucró principalmente a médicos colombianos, significó para el país un perjuicio patrimonial de más de 26.000 millones de pesos en licencias falsas, emitidas ta...'}, {'fecha': '2025-01-22', 'polo': 'negativo', 'text': 'En representación del Comité Evolución Política, tiene la palabra el diputado Jorge Guzmán. la ministra señaló con dureza: “Es fácil levantar discursos simples de temas que son muy complejos”. Y justamente a usted, ministra, la nombraron para resolver temas complejos y no para hacer discursos. La verdad es que respuestas y soluciones a estos problemas no hemos visto. Adicionalmente, a su gobierno, ministra, se le olvida que llegaron al gobiern...'}, {'fecha': '2024-11-14', 'polo': 'negativo', 'text': 'Gracias, diputado. por su intermedio quiero saludar a la ministra. Quiero señalar algo que es sumamente importante: la salud en Chile está enferma, ministra. Si hay alguien que está poniéndole el pecho a las balas y dándole remedio a la salud esos son los funcionarios de la salud, a quienes aprovecho de saludar. Pero, claramente, la situación es sumamente compleja, y desde el gobierno no se están atendiendo las necesidades en la forma que corr...'}]",0.460993,0.908284,0.080102,2.588502,1.680218,1.680218,Mas extremo/a en discurso que en votacion tematica,False,144,56
Stephan Schubert Rubio,stephan schubert rubio,PREP,Independientes,-0.648143,-0.691391,0.026242,-0.699578,-0.596708,2,"[{'fecha': '2024-11-14', 'polo': 'negativo', 'text': 'A continuación, tiene la palabra el diputado Stephan Schubert. en agosto, se terminó el hilo de coser en el hospital regional de La Araucanía, ya que al igual que en otros hospitales, los proveedores dejaron de entregar insumos, debido a las millonarias deudas y extensos retrasos en los pagos. Hoy, tenemos intervenciones quirúrgicas retrasadas no por falta de especialistas o de pabellón, sino por falta de gasa, sutura y oxígeno. Las listas de ...'}, {'fecha': '2024-11-11', 'polo': 'negativo', 'text': 'este proyecto de ley es el más importante del año y será el último presupuesto que ejecutará el Presidente Gabriel Boric, además, en un año electoral. Pero ¿cuál es el escenario en el que se inserta esta discusión? Tenemos un Imacec del último mes de cero por ciento; un IPC que puede llegar al 4,3 o 4,4 por ciento; un crecimiento proyectado para los próximos diez años de 1,8 por ciento; un fondo de reserva que pasó de 7.000 millones a 3.000 mi...'}, {'fecha': '2024-10-16', 'polo': 'negativo', 'text': 'Finalmente, corresponde el uso de la palabra al Comité Republicanos. en este día, en que celebramos el Día del Profesor, quiero hacer una reflexión sobre la dignidad, la importancia y el heroísmo de nuestros profesores a lo largo de Chile. En el contexto actual que enfrenta nuestro país, los profesores emergen como figuras fundamentales en la construcción de un futuro más justo y esperanzador. Su labor, ya de por sí esencial, cobra una relevan...'}]",0.935834,1.779119,0.591946,2.083963,0.304844,0.304844,Alta coincidencia texto-voto,False,164,70
Andrés Longton Herrera,andres longton herrera,RN,Chile Vamos,-0.574327,-0.617575,0.028643,-0.630468,-0.518186,3,"[{'fecha': '2025-11-26', 'polo': 'negativo', 'text': 'la realidad es que en 2021 ingresaron 109.000 inmigrantes de manera ilegal a nuestro país y en 2023, según el INE, había 336.984. Durante este gobierno habrá un récord de inmigrantes ilegales, con más de 145.000 a la fecha. El gobierno constantemente hace una comparación con las cifras de 2021, pero se olvida de que en 2018, 2019 y 2020 hubo una tasa muy baja de inmigración ilegal. Repito: constantemente se refiere al año 2021 para decir que l...'}, {'fecha': '2025-11-17', 'polo': 'negativo', 'text': 'por su intermedio, en la misma línea de lo planteado por el diputado Teao, el per cápita en salud es absolutamente insuficiente, no ha crecido ni un poco. En ese sentido, la necesidad de mayores insumos y de mejoramiento en la atención de salud, particularmente por el aumento de la afluencia de público y de adultos mayores, requiere un per cápita superior del que existe actualmente, y eso lamentablemente no está ocurriendo. Por otro lado, los ...'}, {'fecha': '2024-11-25', 'polo': 'negativo', 'text': 'saludo por su intermedio al ministro de Hacienda, a la subsecretaria de dicha cartera y a la directora de Presupuestos. En el proyecto de ley de presupuestos ha habido avances y también algunos retrocesos. Creemos que es un avance lo que tiene que ver con el Sistema de Admisión Escolar, sobre todo considerando el compromiso relativo a la suspensión del método de selección conocido como “la tómbola” y la modificación de la ley para efectos de p...'}]",0.409468,0.81379,0.114215,1.846623,1.032833,1.032833,Mas extremo/a en discurso que en votacion tematica,False,148,52
Camila Rojas Valderrama,camila rojas valderrama,COMUNES,Frente Amplio,-0.487069,-0.530317,0.028074,-0.542095,-0.432044,4,"[{'fecha': '2025-10-14', 'polo': 'negativo', 'text': 'hechos de violencia ocurren a diario y desde este Congreso nos preguntamos cómo enfrentarlos o, más importante aún, cómo prevenirlos. Este proyecto de ley, en teoría, va en ese sentido. Y digo “en teoría” porque si bien habilita a contar con pórticos de detección de metales en establecimientos educacionales y también en establecimientos de salud, no hay certeza alguna de que aquello pueda reducir o disuadir la violencia. Efectivamente, asisten...'}, {'fecha': '2025-03-04', 'polo': 'negativo', 'text': 'para el estallido social se viralizó una pancarta que decía: “Por ti, mamá, que te llamaron del hospital cuando ya te estábamos velando”. Este ha sido uno de muchos casos y una realidad histórica respecto de las listas de espera. Para el 2023, el 82 por ciento de las personas de nuestro país estaba en el Fonasa. Ese número solo ha ido aumentando en los últimos años, sobre todo por la crisis y la ineficiencia conocida que han tenido las isapres...'}, {'fecha': '2024-04-24', 'polo': 'negativo', 'text': 'luego de escuchar la discusión que se dio en la Comisión de Hacienda, pero también la que hubo en general aquí en la Sala, me parece que algunos, al menos, han perdido de vista la verdadera causa por la cual nos encontramos aquí. Es muy importante recordar que, año tras año, los usuarios de las isapres acudieron masivamente al sistema de justicia, porque hubo contra ellos cobros unilaterales y abusivos por parte de las isapres. Fue precisament...'}]",-0.691964,-1.206182,-0.848651,1.566066,2.772248,2.772248,Mas extremo/a en discurso que en votacion tematica,False,146,8
Carlos Bianchi Chelech,carlos bianchi chelech,IND,Independientes,-0.456904,-0.500152,0.030314,-0.516319,-0.397488,5,"[{'fecha': '2024-11-25', 'polo': 'negativo', 'text': 'quiero expresar mis más sentidas condolencias a quienes están dentro del sector político de nuestra colega recientemente fallecida. Tal como se les comentaba al ministro Mario Marcel, a la directora de Presupuestos y a las autoridades con las que nos reunimos hace poco rato, hay que mirar el debate del proyecto de ley de presupuestos bajo la perspectiva de logros importantes que debemos resaltar y que fueron mucho más allá de la propia discusi...'}, {'fecha': '2024-11-14', 'polo': 'negativo', 'text': 'Estimado señor Presidente, parto por valorar la presencia, una vez más, de la ministra, tal cual lo hizo en la discusión de la Comisión Especial Mixta de Presupuestos. Fue una gran contribución poder estar allí, teniendo un diálogo con la ministra para avanzar en lo que va a significar el protocolo. Entiendo que, una vez finalizadas las distintas intervenciones, la ministra de Salud o el ministro de Hacienda dará cuenta de muchos de los temas ...'}, {'fecha': '2024-11-11', 'polo': 'negativo', 'text': 'Tiene la palabra el Diputado Carlos Bianchi. saludo, por su intermedio, a los ministros, a las subsecretarias y a la directora de Presupuestos, presentes en esta Sala. Efectivamente, estamos frente a una situación económica poco habitual en el país. Eso, para mi gusto, hizo que el Ministerio de Hacienda tuviera una actitud que pocas veces se ve, o que casi nunca se ve, de allanarse al comienzo de la discusión en las respectivas subcomisiones e...'}]",-0.179855,-0.266999,-0.510027,1.469075,1.736074,1.736074,Mas extremo/a en discurso que en votacion tematica,False,142,36
Henry Leal Bizama,henry leal bizama,UDI,Chile Vamos,-0.444327,-0.487575,0.012085,-0.468013,-0.420641,6,"[{'fecha': '2025-06-30', 'polo': 'negativo', 'text': 'votaremos a favor el informe de la comisión especial investigadora de listas de espera. Se trata de un informe completo, que refleja el gran trabajo efectuado. La comisión sesionó en varios lugares del territorio nacional y sus conclusiones eran bastante previsibles: el Estado y el gobierno actual, que lo administra, les han fallado a nuestros enfermos, porque hoy la gente se está muriendo por no recibir atención oportuna. Se suspenden cirugía...'}, {'fecha': '2025-03-04', 'polo': 'negativo', 'text': 'por su intermedio, me dirijo a la señora ministra. En Chile existe una realidad evidente, más allá de las diferencias que podamos tener: tenemos el triste récord de más de tres millones de pacientes en listas de espera, y esa es una realidad cierta e indesmentible. Por eso, frente a todo esfuerzo que vaya orientado a mejorar esas cifras y los tiempos, tenemos que estar de acuerdo y apoyarlo. En ese sentido, tengo algunas dudas respecto de este...'}, {'fecha': '2025-01-22', 'polo': 'negativo', 'text': 'Presidenta, por su intermedio saludo a la señora ministra y a los ministros presentes en la Sala. Ministra, hoy la interpelamos por un tema que es muy relevante para los chilenos: las listas de espera y los problemas de probidad en los distintos hospitales de Chile. Esta interpelación, seguramente, va a demorar dos horas. Mientras conversemos, en esas dos horas van a morir en Chile, en promedio, de diez a doce personas que hoy día están en una...'}]",0.57884,1.12441,0.176014,1.428637,0.304227,0.304227,Alta coincidencia texto-voto,False,140,64
Jaime Naranjo Ortiz,jaime naranjo ortiz,PS,Socialismo Democrático,-0.413373,-0.456621,0.039835,-0.49145,-0.335295,7,"[{'fecha': '2024-12-11', 'polo': 'negativo', 'text': 'como muy bien señalaron los diputados informantes, esta es una aspiración muy legítima de quienes cumplen labores técnicas en el área de la salud. Se trata de una demanda histórica que venimos escuchando hace muchos años por parte de los diferentes gremios que representan a quienes desempeñan dichas labores. En consecuencia, quiero valorar que el gobierno del Presidente Boric, a través de su ministra de Salud, haya impulsado y concretizado est...'}, {'fecha': '2024-11-14', 'polo': 'negativo', 'text': 'saludo a la ministra de Salud, que está presente con nosotros. Creo que por primera vez, cuando uno escucha las distintas exposiciones de las parlamentarias y parlamentarios, encuentra una coincidencia en el diagnóstico y en la grave crisis que vive el sistema de salud. Sin embargo, todas las solicitudes que se hacen -mejorar la infraestructura hospitalaria, acelerar las listas de espera para ver especialistas u operacionesrequieren recursos e...'}, {'fecha': '2024-11-11', 'polo': 'negativo', 'text': 'al inicio de la discusión del proyecto de ley de presupuestos la primera pregunta que uno se tiene que hacer es si acaso este presupuesto responde a las inquietudes y realidades socioeconómicas que vive el país. Debemos despejar esa duda, porque esperamos es que el presupuesto de la nación recoja bien el diagnóstico de nuestra realidad. En ese sentido, al observar la situación del país, creo que en esto todos vamos a coincidir en esta Sala, no...'}]",-0.545197,-0.93702,-0.656312,1.32911,2.26613,2.26613,Mas extremo/a en discurso que en votacion tematica,False,155,18
Felipe Camaño Cárdenas,felipe camano cardenas,IND,Independientes,-0.396744,-0.439992,0.036318,-0.467928,-0.325561,8,"[{'fecha': '2025-09-29', 'polo': 'negativo', 'text': 'discutimos un proyecto para autorizar que los colegios y los centros de salud puedan contar con detectores de metales. Se trata de un proyecto muy triste, porque nos habla de la cruda realidad de nuestros colegios y de nuestra sociedad, en donde la violencia se está apoderando de todos los espacios. Debemos llegar a medidas como esta para proteger a nuestra sociedad y, en especial, a nuestra juventud. En marzo del año pasado, el Colegio Salesi...'}, {'fecha': '2023-11-22', 'polo': 'negativo', 'text': 'Para hablar a favor de la solicitud de resolución, tiene la palabra el diputado Felipe Camaño. como diputados y diputadas, hoy venimos a pedir al Presidente de la República que incluya a los trabajadores sociales en el Código Sanitario. Esta es una demanda histórica del gremio, que nace de la mano de los primeros equipos de salud en el país. Desde 1925 vienen desarrollado una labor irremplazable en la salud pública de Chile. Es más, en Chile s...'}, {'fecha': '2023-11-16', 'polo': 'negativo', 'text': 'en Chile hoy vivimos una crisis en materia de salud. Hay cientos de chilenos y chilenas que mueren antes de que las listas de espera avancen. Esa es una herida que debemos curar. Hay nuevos hospitales semiparalizados, los que podrían cambiarles la vida a las personas y entregarles la dignidad que merecen. El presupuesto de salud es insuficiente. Llegamos a la discusión de este presupuesto con programas rechazados por unanimidad en la Comisión ...'}]",-0.04454,-0.018839,-0.321463,1.275645,1.294484,1.294484,Mas extremo/a en discurso que en votacion tematica,False,118,39
Gael Yeomans Araya,gael yeomans araya,PCS,Frente Amplio,-0.369995,-0.413242,0.032428,-0.433554,-0.306435,9,"[{'fecha': '2024-12-11', 'polo': 'negativo', 'text': 'quiero saludar y hacerme parte del reconocimiento a las trabajadoras y a los trabajadores de la salud que contempla el contenido de este proyecto de ley. En ese sentido, me parece fundamental reconocer y valorar el rol esencial que cumplen día a día, pero también la labor que realizaron con especial compromiso durante la pandemia. Además, quiero saludar el compromiso que tuvo el gobierno para hacerse cargo de esta solicitud, que entre 2023 y 2...'}, {'fecha': '2024-11-14', 'polo': 'negativo', 'text': 'Ha concluido su tiempo, diputada. por su intermedio saludo a la ministra de Salud y celebro que esté presente en una discusión tan importante como esta. Cuando hablamos del Ministerio de Salud en la discusión del proyecto de ley de presupuestos, hablamos de una de las áreas prioritarias, no solo para el gobierno, sino también para la ciudadanía. Por ello, se debe poner énfasis en el gasto, pero no entenderlo simplemente como un gasto, porque e...'}, {'fecha': '2024-05-13', 'polo': 'negativo', 'text': 'el sistema de isapres fracasó, no dio el ancho, y, además, fracasó en su propia ley. Nos dijeron que el sistema privado era lo más eficiente del mundo, y resulta que van a tener que presentar medidas para mejorar su eficiencia, conforme a lo establecido en este proyecto de ley. Nos dijeron que el mercado era justo, que se regula solo, y terminaron abusando de todos sus afiliados con cobros discriminatorios e ilegales. Lo paradójico es que las ...'}]",-0.682212,-1.188298,-0.816543,1.189637,2.377935,2.377935,Mas extremo/a en discurso que en votacion tematica,False,153,10
Francisco Undurraga Gazitúa,francisco undurraga gazitua,EVOP,Chile Vamos,-0.367415,-0.410663,0.036261,-0.438486,-0.296343,10,"[{'fecha': '2025-09-29', 'polo': 'negativo', 'text': 'quiero señalar varias cosas en relación con este proyecto, que no me cabe ninguna duda de que tiene grandes y muy buenas intenciones. Qué mejor que prevenir no solo el cáncer, sino todo tipo de enfermedades. Pero me parece que este proyecto contiene varias situaciones que deberían haber sido contempladas al menos por la Secretaría de la comisión. El mayor empleador en Chile es el Estado, y en este proyecto no veo un patrocinio del Ministerio d...'}, {'fecha': '2024-04-24', 'polo': 'negativo', 'text': 'por su intermedio saludo a la ministra Ximena Aguilera, a nuestro excolega Víctor Torres y al ministro Álvaro Elizalde. Si caen las isapres, caen con ellas casi tres millones de beneficiarios, que se verán obligados a emigrar al sistema público. Si colapsa el sistema privado, serán los chilenos quienes deberán ingresar a un sistema ya saturado y que no da abasto. No me quiero detener en los responsables, sino en los perjudicados. Nadie quiere ...'}, {'fecha': '2023-11-20', 'polo': 'negativo', 'text': 'Para plantear un punto de Reglamento, tiene la palabra el diputado Francisco Undurraga. sobre la Cuenta, en particular respecto de lo consignado en el punto N° 9, sin perjuicio de que entiendo la motivación de los diputados mocionantes respecto del proyecto de ley correspondiente al boletín N° 16428-04, que establece un sistema de protección para estudiantes de educación superior que requieren cuidados en su salud mental, solicito que esta ini...'}]",0.402088,0.800255,0.097448,1.181343,0.381088,0.381088,Alta coincidencia texto-voto,False,159,50
Felipe Donoso Castro,felipe donoso castro,UDI,Chile Vamos,-0.350083,-0.393331,0.041707,-0.431829,-0.268337,11,[],0.706232,1.35804,0.23873,1.125615,-0.232425,0.232425,Alta coincidencia texto-voto,False,155,69
Francesca Muñoz González,francesca munoz gonzalez,RN,Republicanos,-0.327705,-0.370953,0.039385,-0.404901,-0.25051,12,[],0.555187,1.081031,0.161335,1.053665,-0.027367,0.027367,Alta coincidencia texto-voto,False,136,63
Marta González Olea,marta gonzalez olea,IND,Independientes,-0.304988,-0.348236,0.033977,-0.371582,-0.238394,13,[],-0.34524,-0.570307,-0.563816,0.980622,1.55093,1.55093,Mas extremo/a en discurso que en votacion tematica,False,112,28
Ricardo Cifuentes Lillo,ricardo cifuentes lillo,DC,DC,-0.285806,-0.329054,0.03564,-0.35566,-0.215953,14,[],-0.209476,-0.321322,-0.457116,0.918947,1.24027,1.24027,Mas extremo/a en discurso que en votacion tematica,False,139,35
Luis Sánchez Ossa,luis sanchez ossa,PREP,Republicanos,-0.273547,-0.316795,0.031273,-0.334842,-0.212252,15,[],0.971662,1.844825,0.608356,0.879531,-0.965294,0.965294,Mas moderado/a en discurso que en votacion tematica,False,167,73
Flor Weisse Novoa,flor weisse novoa,UDI,Chile Vamos,-0.273231,-0.316479,0.029029,-0.330127,-0.216334,16,[],0.685111,1.319305,0.265192,0.878514,-0.440791,0.440791,Alta coincidencia texto-voto,False,140,68
Frank Sauerbaum Muñoz,frank sauerbaum munoz,RN,Chile Vamos,-0.2329,-0.276148,0.026005,-0.283869,-0.181931,17,[],0.465945,0.917365,0.151774,0.748839,-0.168526,0.168526,Alta coincidencia texto-voto,False,144,57
Javiera Morales Alvarado,javiera morales alvarado,FA,Frente Amplio,-0.22858,-0.271828,0.036306,-0.29974,-0.157421,18,[],-0.704973,-1.23004,-0.74022,0.73495,1.96499,1.96499,Mas extremo/a en discurso que en votacion tematica,False,149,7
Diego Schalper Sepúlveda,diego schalper sepulveda,RN,Chile Vamos,-0.227828,-0.271075,0.031638,-0.289838,-0.165817,19,[],0.373009,0.746926,0.144067,0.73253,-0.014396,0.014396,Alta coincidencia texto-voto,False,124,49
Erika Olivera De La Fuente,erika olivera de la fuente,IND,Independientes,-0.209424,-0.252672,0.032525,-0.273173,-0.145675,20,[],-0.054727,-0.037522,-0.273601,0.673356,0.710878,0.710878,Mas extremo/a en discurso que en votacion tematica,False,133,38
Ana María Bravo Castro,ana maria bravo castro,PS,Socialismo Democrático,-0.204967,-0.248215,0.037756,-0.278969,-0.130965,21,[],-0.422235,-0.711512,-0.649081,0.659027,1.370539,1.370539,Mas extremo/a en discurso que en votacion tematica,False,151,22
Boris Barrera Moreno,boris barrera moreno,PC,PC + FRVS + AH,-0.180105,-0.223353,0.025182,-0.229461,-0.130749,22,[],-0.763568,-1.3375,-0.919251,0.579087,1.916587,1.916587,Mas extremo/a en discurso que en votacion tematica,False,160,5
Hotuiti Teao Drago,hotuiti teao drago,IND,Independientes,-0.156209,-0.199457,0.030763,-0.216505,-0.095913,23,[],0.540675,1.054418,0.140539,0.502256,-0.552161,0.552161,Mas moderado/a en discurso que en votacion tematica,False,140,60
Alberto Undurraga Vicuña,alberto undurraga vicuna,DC,DC,-0.149426,-0.192674,0.038287,-0.224468,-0.074384,24,[],-0.216273,-0.333788,-0.462518,0.480447,0.814235,0.814235,Mas extremo/a en discurso que en votacion tematica,False,150,34
Nathalie Castillo Rojas,nathalie castillo rojas,PC,PC + FRVS + AH,-0.128949,-0.172197,0.032403,-0.192459,-0.065439,25,[],-1.0,-1.771105,-0.870073,0.414609,2.185714,2.185714,Mas extremo/a en discurso que en votacion tematica,False,136,1
Joanna Pérez Olea,joanna perez olea,DC,Demócratas + Amarillos,-0.086374,-0.129622,0.023932,-0.133282,-0.039467,26,[],0.018327,0.096456,-0.260634,0.277718,0.181262,0.181262,Alta coincidencia texto-voto,False,123,41
Camila Musante Müller,camila musante muller,IND,Independientes,-0.084782,-0.12803,0.051854,-0.186415,0.016851,27,[],-0.452738,-0.767453,-0.598434,0.272597,1.040051,1.040051,Mas extremo/a en discurso que en votacion tematica,False,132,21
Carla Morales Maldonado,carla morales maldonado,RN,Chile Vamos,-0.083024,-0.126272,0.042626,-0.166571,0.000524,28,[],0.407184,0.809602,0.099457,0.266945,-0.542657,0.542657,Mas moderado/a en discurso que en votacion tematica,False,134,51
Marcela Riquelme Aliaga,marcela riquelme aliaga,IND,Independientes,-0.057079,-0.100327,0.047738,-0.150647,0.036488,29,[],-0.626565,-1.086244,-0.792168,0.183526,1.269771,1.269771,Mas extremo/a en discurso que en votacion tematica,False,124,14
Carolina Tello Rojas,carolina tello rojas,FA,PC + FRVS + AH,-0.050853,-0.094101,0.036061,-0.121532,0.019826,30,[],-0.757025,-1.325502,-0.841432,0.163507,1.489009,1.489009,Mas extremo/a en discurso que en votacion tematica,False,159,6
Rubén Darío Oyarzo Figueroa,ruben dario oyarzo figueroa,IND,PDG,-0.04962,-0.092868,0.037752,-0.123613,0.024373,31,[],-0.002462,0.058331,-0.299294,0.159541,0.101211,0.101211,Alta coincidencia texto-voto,False,168,40
Roberto Arroyo Muñoz,roberto arroyo munoz,PSC,Republicanos,-0.043423,-0.086671,0.037147,-0.116231,0.029384,32,[],0.281897,0.57983,0.066908,0.139619,-0.440212,0.440212,Alta coincidencia texto-voto,False,117,44
Daniel Melo Contreras,daniel melo contreras,PS,Socialismo Democrático,-0.041657,-0.084904,0.032006,-0.104388,0.021075,33,[],-0.473441,-0.805421,-0.655472,0.133938,0.939359,0.939359,Mas extremo/a en discurso que en votacion tematica,False,114,20
Johannes Kaiser Barents-Von Hohenhagen,johannes kaiser barents von hohenhagen,PNL,Independientes,-0.000257,-0.043505,0.03097,-0.060957,0.060443,34,[],0.949126,1.803496,0.618082,0.000826,-1.80267,1.80267,Mas moderado/a en discurso que en votacion tematica,False,164,71
Jaime Sáez Quiroz,jaime saez quiroz,FA,Frente Amplio,0.00463,-0.038618,0.04237,-0.078415,0.087675,35,[],-0.675196,-1.17543,-0.828582,-0.014887,1.160544,1.160544,Mas extremo/a en discurso que en votacion tematica,False,151,12
Ana María Gazmuri Vieira,ana maria gazmuri vieira,PAH,PC + FRVS + AH,0.009128,-0.03412,0.01421,-0.018723,0.036979,36,[],-0.768661,-1.346841,-0.932431,-0.029349,1.317493,1.317493,Mas extremo/a en discurso que en votacion tematica,False,156,4
Hernán Palma Pérez,hernan palma perez,IND,Independientes,0.012727,-0.030521,0.019601,-0.025691,0.051145,37,[],-0.846866,-1.490265,-0.92005,-0.040921,1.449345,1.449345,Mas extremo/a en discurso que en votacion tematica,False,158,2
Andrés Jouannet Valderrama,andres jouannet valderrama,AMA,Demócratas + Amarillos,0.020724,-0.022523,0.047768,-0.072901,0.11435,38,[],0.116333,0.276194,-0.286982,-0.066635,-0.342829,0.342829,Alta coincidencia texto-voto,False,137,42
Juan Carlos Beltrán Silva,juan carlos beltran silva,RN,Chile Vamos,0.033206,-0.010042,0.028219,-0.022103,0.088515,39,[],0.418211,0.829825,0.124794,-0.106767,-0.936592,0.936592,Mas moderado/a en discurso que en votacion tematica,False,151,54
Hugo Rey Martínez,hugo rey martinez,RN,Chile Vamos,0.035313,-0.007935,0.024288,-0.012291,0.082917,40,[],0.343513,0.692831,0.097906,-0.113541,-0.806372,0.806372,Mas moderado/a en discurso que en votacion tematica,False,148,46
Agustín Romero Leiva,agustin romero leiva,PREP,Republicanos,0.049217,0.005969,0.017996,0.013946,0.084489,41,[],0.96793,1.837982,0.605007,-0.158247,-1.996229,1.996229,Mas moderado/a en discurso que en votacion tematica,False,162,72
Marcos Ilabaca Cerda,marcos ilabaca cerda,PS,Socialismo Democrático,0.074324,0.031076,0.033952,0.007778,0.14087,42,[],-0.413766,-0.695981,-0.619173,-0.238973,0.457008,0.457008,Alta coincidencia texto-voto,False,137,24
Andrés Giordano Salazar,andres giordano salazar,FA,Independientes,0.07538,0.032133,0.030599,0.015406,0.135355,43,[],-0.688948,-1.200652,-0.809476,-0.242369,0.958282,0.958282,Mas extremo/a en discurso que en votacion tematica,False,142,9
Emilia Nuyado Ancapichun,emilia nuyado ancapichun,PS,Socialismo Democrático,0.093424,0.050176,0.04984,-0.004262,0.191109,44,[],-0.579732,-1.000355,-0.731874,-0.300384,0.699971,0.699971,Mas extremo/a en discurso que en votacion tematica,False,138,15
